{
  "schema_version": "1.0",
  "id": "KIP2-MEM-020",
  "title": "Mutable cache planes are all guarded",
  "description": "Race a verdict with a GradingState/TrialState/MnemonicState update. A verdict that\nread-modify-writes those planes guards all of them and either commits once or\nrefreshes on conflict. Guarding only ATTRIBUTES cannot justify overwriting a\nconcurrently changed grading or utility cache. No partial verdict/status commit.",
  "level": "MUST",
  "class": "black_box",
  "profiles": [
    "KIP-CognitiveMemory"
  ],
  "fixture": {
    "name": "cognitive-consistency",
    "reset": true
  },
  "spec_refs": [
    "KIP-2.0-Cognitive-Consistency.md"
  ],
  "steps": [
    {
      "id": "exercise",
      "kind": "harness",
      "action": "exercise_memory_scenario",
      "args": {
        "id": "KIP2-MEM-020"
      }
    }
  ],
  "assertions": [
    {
      "source": "step",
      "step": "exercise",
      "path": "/stale_plane_write_rejected",
      "operator": "equals",
      "expected": true
    }
  ],
  "postconditions": [
    {
      "source": "state",
      "path": "/partial_verdict_commit",
      "operator": "equals",
      "expected": false
    }
  ]
}
